,abstract,link4download,links,num_citations,num_downloads_cu,publication_date,title,venue
0,"Most of the problems facing the designers of a public cloud are extensions of what we face in any data center: detecting and preventing intrusions, coping with DoS attacks, and keeping the various services largely isolated from one another. There are some new challenges: how to control the behavior of customers when your privacy guarantees prevent you from looking too closely at what they are doing, how to protect them from network based attacks when you don't know what kind of traffic is normal, and how to guarantee them resources when the behavior of others sharing the hardware is unpredictable. There are also some new advantages: centrally managing software maintenance can assure that patches are installed promptly, and scale permits a permanent staff of experienced trouble shooters to handle what would be rare problems for any individual customer.",https://dl.acm.org/ft_gateway.cfm?id=2046668&ftid=1047106&dwn=1&CFID=84020132&CFTOKEN=a6f8f8e912c797a3-8C549BFF-CC18-FBDE-FEB65C7292D379D9,https://dl.acm.org/citation.cfm?id=2046668&preflayout=flat,0,"2,103",October 2011,What's different about security in a public cloud?,CCSW '11: Proceedings of the 3rd ACM workshop on Cloud computing security workshop
1,"Cloud computing has become increasingly popular and important. Many companies have policy initiatives encouraging or even mandating the use of ""cloud"" computing. The popularity of cloud computing stems primarily from the hope for significant cost savings but also from the ability to scale quickly without large capital expenditures and efficient sharing and curation of very large data sets (for example, search indexes). Clouds, like distributed computing generally, also offers the ability to access data and resources from any connected device (increasingly mobile devices like smart phones and lightweight tablets like iPads). However, cloud computing in all its incarnations (Infrastructure as a Service, Software as a Service, Platform as a Service) raises a number of security questions that current providers have not addressed (or remain ominously silent about): increased susceptibility to insider attacks due to concentration of valuable data, ""fate-sharing"" and other vulnerabilities due to multi-tenancy, policy issues arising from multi-jurisdictional siting, vulnerabilities arising from scale operations, the opacity of cloud operators security practices and disclosure of interruption of operations or attacks. Despite these potential issues, cloud computing can be beneficial with judicial and transparent application of some simple security principles. We discuss cloud infrastructure, economics, operations and security infrastructure desiderata.",https://dl.acm.org/ft_gateway.cfm?id=2046662&ftid=1047102&dwn=1&CFID=84020132&CFTOKEN=a6f8f8e912c797a3-8C549BFF-CC18-FBDE-FEB65C7292D379D9,https://dl.acm.org/citation.cfm?id=2046662&preflayout=flat,0,845,October 2011,Clouds and their discontents,CCSW '11: Proceedings of the 3rd ACM workshop on Cloud computing security workshop
2,"Can the cloud truly be secured? Can enterprises, universities, small businesses and governments securely utilize the cloud for their critical infrastructure? It will take rethinking our current security policies and what we consider secure. This session will cover what is necessary to utilize the cloud securely today and how the cloud should adapt for the future.",https://dl.acm.org/ft_gateway.cfm?id=2046674&ftid=1047110&dwn=1&CFID=84020132&CFTOKEN=a6f8f8e912c797a3-8C549BFF-CC18-FBDE-FEB65C7292D379D9,https://dl.acm.org/citation.cfm?id=2046674&preflayout=flat,0,"1,975",October 2011,Cloud security: myth or reality?,CCSW '11: Proceedings of the 3rd ACM workshop on Cloud computing security workshop
3,"Cloud computing is a long fantasized visualization of computing as a utility, where data owners can remotely store and access their data in the cloud anytime and from anywhere. Using a shared pool of configurable resources, users can be relieved from the burden of local data storage and upkeep. The security of cloud computing has always been an important aspect of quality of service from cloud service providers. However, cloud computing poses many new security challenges which have not been well investigated. This paper provides an analysis of cloud computing, cloud data storage security, the security risks that involve using the cloud, security policies, physical security, and software security pertaining to the cloud. Our research work indicates that cloud computing combined with a trusted computing platform can provide some important security services, including authentication, confidentiality, and integrity.",https://dl.acm.org/ft_gateway.cfm?id=2331767&ftid=1263361&dwn=1&CFID=84020132&CFTOKEN=a6f8f8e912c797a3-8C549BFF-CC18-FBDE-FEB65C7292D379D9,https://dl.acm.org/citation.cfm?id=2331767&preflayout=flat,6,"2,259",March 2012,Different facets of security in the cloud,CNS '12: Proceedings of the 15th Communications and Networking Simulation Symposium
4,"It is recognized that the most important obstacle to the development of the cloud is the variety of new security threats which requests new methods and mechanisms. This is even truer for those who want to deploy business processes, because of the critical knowledge they encapsulate in terms of know-how and data. This paper proposes an approach combining modeling techniques and cloud selection for a trusted deployment of a security risk-aware business process in security constrained clouds.",https://dl.acm.org/ft_gateway.cfm?id=2536164&ftid=1414377&dwn=1&CFID=84020132&CFTOKEN=a6f8f8e912c797a3-8C549BFF-CC18-FBDE-FEB65C7292D379D9,https://dl.acm.org/citation.cfm?id=2536164&preflayout=flat,1,341,October 2013,A general approach for a trusted deployment of a business process in clouds,MEDES '13: Proceedings of the Fifth International Conference on Management of Emergent Digital EcoSystems
5,"Auditing message exchange in a cloud involves logging interactions between services that are dynamically composed to satisfy a client's request to the cloud. Additional cloud management services are needed to facilitate audit record capture of events occurring within the end-to-end round trip messaging of the composition and to analyze the resulting audit assets for security anomalies. When an external cloud, possibly in a federation, has a service needed for the task, audit assets must be conveyed back to the originating cloud for disclosure of communications and resource accesses. Otherwise, the external cloud may hide any potential vulnerabilities related to information tainting, message attacks, and resource misuse since these security risks cannot be directly assessed. In this paper, we underscore the importance of designing cross-cloud communications to retain security audit information to assess message and resource vulnerabilities and maintain federation trust. We present an architecture and a message schema for management, communication, and analysis.",https://dl.acm.org/ft_gateway.cfm?id=2459981&ftid=1360970&dwn=1&CFID=84020132&CFTOKEN=a6f8f8e912c797a3-8C549BFF-CC18-FBDE-FEB65C7292D379D9,https://dl.acm.org/citation.cfm?id=2459981&preflayout=flat,0,400,January 2013,An architecture for cross-cloud auditing,CSIIRW '13: Proceedings of the Eighth Annual Cyber Security and Information Intelligence Research Workshop
6,"Due to the many advantages offered by the cloud computing paradigm, it is fast becoming an enabling technology for many organizations, and even individual users. Flexibility and availability are two of the most important features that promote the wide spread adoption of this technology. In cloud-based data storage scenarios, where the data is controlled by a third party (i.e. the cloud service provider), the data owner usually does not have full control of its data at all stages. Consequently, this poses a prime security threat, and a major challenge is the development of a secure protocol for data storage, sharing, and retrieval. In recent years, a number of research works have targeted this problem. In this paper, we discuss some of the major approaches for secure data sharing in the cloud computing environment. The goal is to provide a concise survey of existing solutions, discuss their benefits, and point out any shortcomings for future research. Specifically, we focus on the use of encryption schemes, and provide a comparative study of the major schemes, through implementation of some representative frameworks.",https://dl.acm.org/ft_gateway.cfm?id=2668278&ftid=1505206&dwn=1&CFID=84020132&CFTOKEN=a6f8f8e912c797a3-8C549BFF-CC18-FBDE-FEB65C7292D379D9,https://dl.acm.org/citation.cfm?id=2668278&preflayout=flat,1,417,September 2014,An Experimental Evaluation of Data Confidentiality Measures on the Cloud,MEDES '14: Proceedings of the 6th International Conference on Management of Emergent Digital EcoSystems
7,"As more and more organization move to the cloud, security remains a major concern. Given the unique nature of a cloud computing system, security threats take a different form in the cloud. These unique threats require unique security measures and security management.",https://dl.acm.org/ft_gateway.cfm?id=3231831&ftid=2013151&dwn=1&CFID=84020132&CFTOKEN=a6f8f8e912c797a3-8C549BFF-CC18-FBDE-FEB65C7292D379D9,https://dl.acm.org/citation.cfm?id=3231831&preflayout=flat,0,176,November 2017,Prioritizing Cloud Security Controls,"AWICT 2017: Proceedings of the Second International Conference on Advanced Wireless Information, Data, and Communication Technologies"
8,"This article presents a brief overview on cloud computing security in terms of security considerations, models, threats and precautions. The articles published in recent years were classified and they were then analyzed in terms of problems, solutions and challenges. It should be concluded that standards, measurements and metrics for evaluations of threats need to be initially discussed carefully and then applied to the real applications.",https://dl.acm.org/ft_gateway.cfm?id=2527013&ftid=1418908&dwn=1&CFID=84020132&CFTOKEN=a6f8f8e912c797a3-8C549BFF-CC18-FBDE-FEB65C7292D379D9,https://dl.acm.org/citation.cfm?id=2527013&preflayout=flat,1,"1,593",November 2013,A review on cloud security,SIN '13: Proceedings of the 6th International Conference on Security of Information and Networks
9,"Enforcing security properties in a Cloud is a difficult task, which requires expertise. However, it is not the only security-related challenge met by a company migrating to a Cloud environment. Indeed, the tenant must also have assurance that the requested security properties have effectively been enforced. Therefore, the Cloud provider has to offer a way of monitoring the security. In this paper, we present a solution to express the assurance properties based on the security requirements of the tenant and to deploy these assurance properties. First, we introduce a language that expresses the assurance based on the tenant's security requirements. Secondly, we propose an infrastructure that deploys the assurance in a Cloud environment. This solution aims to be easy to use: the assurance directly results from the high-level expression of the tenant's security requirements, and no additional action is needed from the tenant. Consequently, we address one of the greatest drawback of security and assurance - the complexity of their configuration - while providing a complete assurance mechanism.",https://dl.acm.org/ft_gateway.cfm?id=2752500&ftid=1589456&dwn=1&CFID=84020132&CFTOKEN=a6f8f8e912c797a3-8C549BFF-CC18-FBDE-FEB65C7292D379D9,https://dl.acm.org/citation.cfm?id=2752500&preflayout=flat,0,214,June 2015,An Autonomic Cloud Management System for Enforcing Security and Assurance Properties,CLHS '15: Proceedings of the 2015 Workshop on Changing Landscapes in HPC Security
10,"In this paper, we present the core security architecture of SecureSafe, a cloud service that provides a highly secure online storage for sensitive data. The architecture combines best practices in cryptography and security protocols with novel approaches to offer high security while providing good usability and performance. More than two years of successful operation with many satisfied customers and no security incidents demonstrate the soundness of the architecture. In addition to granting insight into the security architecture of a field-proven service to provide inputs for other services that have similar requirements, there's another motivation for this paper: We believe that to increase trust in cloud services, service providers should be more open about internal security details -- although this is in contrast to what typical cloud service providers do today.",https://dl.acm.org/ft_gateway.cfm?id=2181197&ftid=1198535&dwn=1&CFID=84020132&CFTOKEN=a6f8f8e912c797a3-8C549BFF-CC18-FBDE-FEB65C7292D379D9,https://dl.acm.org/citation.cfm?id=2181197&preflayout=flat,0,261,April 2012,SecureSafe: a highly secure online data safe industrial use case,"MPM '12: Proceedings of the First Workshop on Measurement, Privacy, and Mobility"
11,"In modern days, use of service-oriented architecture (SoA) is becoming popular due to the use of public cloud. A cloud can provide storage services, computing services and infrastructure without any capital or operational expenditure. From a single user to a multi-national million dollar business can easily receive several types of services from a public cloud. There are numerous cloud providers in the market. Among the prominent ones, such as Amazon AWS, Google Cloud Platform (GCP), and Microsoft Azure etc. GCP offers a wide array of services for many organizations and individuals around the world like other cloud providers. However, the question is, all those data, confidential information, intellectual property of individual or industries safe enough? Information has become the most expensive commodity in modern days. A government can be shutdown, a transport system can be disabled, annoying spam calls, phishing emails, cyber bullying and more security threats exist around us. Can we trust a public service provider? Hence, our initiative aims at investigating that GCP is secure from inside attackers. Why we chose inside attackers? Well the idea is to check if GCP can detect and ignore an attack launched internally. In this case, it should be secure enough to prevent from outsiders as well. The research investigation would involve Distributed Denial of Service (DDoS) attacks against a local virtual machine (VM) launched from GCP. There is a broad spectrum of VMs available in GCP compute engine service.",https://dl.acm.org/ft_gateway.cfm?id=3363371&ftid=2094291&dwn=1&CFID=84020132&CFTOKEN=a6f8f8e912c797a3-8C549BFF-CC18-FBDE-FEB65C7292D379D9,https://dl.acm.org/citation.cfm?id=3363371&preflayout=flat,0,28,November 2019,Google cloud platform security,SEC '19: Proceedings of the 4th ACM/IEEE Symposium on Edge Computing
12,"In 2038 we have lived though a decade during which the world's global computational infrastructure undermined privacy and trust in virtually every aspect of our lives. The problems were seen far in advance, but it was commonplace belief that a combination of cryptography and more distributed responsibilty in systems---'blockchains for everything, and all hail the cloud'---would together restore what had been lost in the first decades of the 21st century. As it turned out, it was these very technologies that ended up destroying the privacy and trust we had left.",https://dl.acm.org/ft_gateway.cfm?id=3285012&ftid=2040205&dwn=1&CFID=84020132&CFTOKEN=a6f8f8e912c797a3-8C549BFF-CC18-FBDE-FEB65C7292D379D9,https://dl.acm.org/citation.cfm?id=3285012&preflayout=flat,0,54,August 2018,After the BlockCLoud Apocalypse,NSPW '18: Proceedings of the New Security Paradigms Workshop
13,"Cloud Computing is the latest technology that has come to the center-stage because of its ability to achieve economies of scale, quite like mass-production. However, shifting to Cloud comes with certain strings attached, especially security concerns associated with outsourcing critical data and processing to a third party. One way to tackle the security issues can be approaching it using Quantum Computing, which itself is a highly researched area with huge expectations from the researchers. So far, the two fields (viz. Cloud Computing and Quantum Computing), have been researched independent of each other. The paper explains why they should be integrated. The paper presents quantum cryptographic protocols and studies their application in enhancing Cloud security, particularly Network security and Data security. Further, it outlines the work that can be done and finally, seeks to identify possible research directions.",https://dl.acm.org/ft_gateway.cfm?id=2818672&ftid=1633346&dwn=1&CFID=84020132&CFTOKEN=a6f8f8e912c797a3-8C549BFF-CC18-FBDE-FEB65C7292D379D9,https://dl.acm.org/citation.cfm?id=2818672&preflayout=flat,0,360,September 2015,A Study on Quantum Cryptography Based Security Management in Cloud,ICCCT '15: Proceedings of the Sixth International Conference on Computer and Communication Technology 2015
14,"In this poster, we present TrustDraw, a transparent security extension for the cloud which combines Virtual Machine Introspection (VMI) and Trusted Computing (TC). TrustDraw provides secure storage of critical data like keys or passwords and allows to temporarily insert this data into a running virtual machine (VM) if required. TrustDraw improves security by allowing access to the critical data only if certain previously defined conditions are met. This way, the stealing of critical data by bypassing access permissions based on successfully executed attacks can be mitigated. TrustDraw runs isolated and transparent. No software modifications are required on a target VM. We evaluated an implementation of TrustDraw in a realistic scenario in which it only caused an acceptable run-time delay.",https://dl.acm.org/ft_gateway.cfm?id=2512506&ftid=1411953&dwn=1&CFID=84020132&CFTOKEN=a6f8f8e912c797a3-8C549BFF-CC18-FBDE-FEB65C7292D379D9,https://dl.acm.org/citation.cfm?id=2512506&preflayout=flat,0,324,November 2013,POSTER: Event-based isolation of critical data in the cloud,CCS '13: Proceedings of the 2013 ACM SIGSAC conference on Computer & communications security
15,"Enterprises continue to migrate their services to the cloud on a massive scale, but the increasing attack surface has become a natural target for malevolent actors. We show policy injection, a novel algorithmic complexity attack that enables a tenant to add specially tailored ACLs into the data center fabric to mount a denial-of-service attack through exploiting the built-in security mechanisms of the cloud management systems (CMS). Our insight is that certain ACLs, when fed with special covert packets by an attacker, may be very difficult to evaluate, leading to an exhaustion of cloud resources. We show how a tenant can inject seemingly harmless ACLs into the cloud data plane to abuse an algorithmic deficiency in the most popular cloud hypervisor switch, Open vSwitch, and reduce its effective peak performance by 80--90%, and, in certain cases, denying network access altogether.",https://dl.acm.org/ft_gateway.cfm?id=3234250&ftid=1992994&dwn=1&CFID=84020132&CFTOKEN=a6f8f8e912c797a3-8C549BFF-CC18-FBDE-FEB65C7292D379D9,https://dl.acm.org/citation.cfm?id=3234250&preflayout=flat,2,158,August 2018,Policy Injection: A Cloud Dataplane DoS Attack,SIGCOMM '18: Proceedings of the ACM SIGCOMM 2018 Conference on Posters and Demos
16,"A consolidated trend in designing cloud-based applications is to make use of a reactive microservice architecture, which allows to divide an application in several well-partitioned software units with specific responsibilities. Such an architecture perfectly fits in cloud environments, ensuring a number of advantages (i.e., high availability and scalability, ease of deployment and development). However, the new way of designing cloud applications introduces challenging security threats. Besides the difficulty in monitoring security of the overall distributed application, an important aspect of concern relates to the risk of break the chain of trust established among the different microservices belonging to the application. That is, a compromised single microservice may bring down the other related ones.",https://dl.acm.org/ft_gateway.cfm?id=3105820&ftid=1899464&dwn=1&CFID=84020132&CFTOKEN=a6f8f8e912c797a3-8C549BFF-CC18-FBDE-FEB65C7292D379D9,https://dl.acm.org/citation.cfm?id=3105820&preflayout=flat,0,217,August 2017,Integrating Reactive Cloud Applications in SERECA,"ARES '17: Proceedings of the 12th International Conference on Availability, Reliability and Security"
17,"The convergence of virtualization with Cloud computing has brought many benefits to organizations including ease of deployment, reduced costs and high availability of resources over internet. Extensive research has been carried out to increase the security of Cloud virtualization environment. However, addressing the security concerns of disk images used by virtual machines is still an open challenge. Compromising the disk images can result in loss of data integrity and confidentiality. This paper proposes a novel security scheme ""Encrypted Virtual Disk Images in Cloud (EVDIC)"" for the protection of stored disk images in Cloud by encryption. EVDIC also includes the security of key management and key exchange process. We integrate EVDIC with OpenStack, which is an open source Cloud platform largely used around the world.",https://dl.acm.org/ft_gateway.cfm?id=2523576&ftid=1418932&dwn=1&CFID=84020132&CFTOKEN=a6f8f8e912c797a3-8C549BFF-CC18-FBDE-FEB65C7292D379D9,https://dl.acm.org/citation.cfm?id=2523576&preflayout=flat,4,419,November 2013,Securing the virtual machine images in cloud computing,SIN '13: Proceedings of the 6th International Conference on Security of Information and Networks
18,"Virtual Routers (VRs) are increasingly common in cloud environments. VRs route traffic between network segments and support network services. Routers, including VRs, have been the target of several recent high-profile attacks, emphasizing the need for more security measures, including security monitoring. However, existing agent-based monitoring systems are incompatible with a VR's temporary nature, stripped-down operating system, and placement in the cloud. As a result, VRs are often not monitored, leading to undetected security incidents.",https://dl.acm.org/ft_gateway.cfm?id=3064829&ftid=1865398&dwn=1&CFID=84020132&CFTOKEN=a6f8f8e912c797a3-8C549BFF-CC18-FBDE-FEB65C7292D379D9,https://dl.acm.org/citation.cfm?id=3064829&preflayout=flat,1,111,April 2017,Arav: monitoring a cloud's virtual routers,CISRC '17: Proceedings of the 12th Annual Conference on Cyber and Information Security Research
19,"Though there has been much study of information leakage channels exploiting shared hardware resources (memory, cache, and disk) in cloud environments, there has been less study of the exploitability of shared software resources. In this paper, we analyze the exploitability of cloud networking services (which are shared among cloud tenants) and introduce a practical method for building information leakage channels by monitoring workloads on the cloud networking services through the virtual firewall. We also demonstrate the practicality of this attack by implementing two different covert channels in OpenStack as well as a new class of side channels that can eavesdrop on infrastructure-level events. By utilizing a Long Short-Term Memory (LSTM) neural network model, our side channel attack could detect infrastructure level VM creation/termination events with 93.3% accuracy.",https://dl.acm.org/ft_gateway.cfm?id=3267843&ftid=2006392&dwn=1&CFID=84020132&CFTOKEN=a6f8f8e912c797a3-8C549BFF-CC18-FBDE-FEB65C7292D379D9,https://dl.acm.org/citation.cfm?id=3267843&preflayout=flat,0,115,October 2018,I Heard It through the Firewall: Exploiting Cloud Management Services as an Information Leakage Channel,SoCC '18: Proceedings of the ACM Symposium on Cloud Computing
20,"Cloud computing is an emerging service that enables users to store and manage their data easily at a low cost. We propose a Deduplicating Secure Backup System with Encryption Intensity Selection (DSB-SEIS) that combines features to amend security and performance of cloud-based backup services. Our scheme introduces the concept of encryption intensity selection to cloud backup systems, which allows users to select the encryption intensity of their files. We also combine features such as deduplication, assured deletion, and multi-aspect awareness to further enhance our scheme. The DSB-SEIS performance is measured over an OpenStack cloud installed on CloudLab resources demonstrating that DSB-SEIS can improve the backup service.",https://dl.acm.org/ft_gateway.cfm?id=2955208&ftid=1759050&dwn=1&CFID=84020132&CFTOKEN=a6f8f8e912c797a3-8C549BFF-CC18-FBDE-FEB65C7292D379D9,https://dl.acm.org/citation.cfm?id=2955208&preflayout=flat,0,109,July 2016,DSB-SEIS: a deduplicating secure backup system with encryption intensity selection,DCC '16: Proceedings of the 4th Workshop on Distributed Cloud Computing
