,abstract,link4download,links,num_citations,num_downloads_cu,publication_date,title,venue
80,"5G will support a wide range of industry verticals and security is fundamental to successfully deliver 5G networks for different kind of use cases. Heterogeneous devices and applications will lead to different security requirements to be covered by diverse security functions. Security management in 5G networks should meet the needs of heterogeneous business models in the 5G ecosystem and address the motivations from the different stakeholders. We present a framework for automated security event management to offer security monitoring and correlation capabilities to mobile network operators, infrastructure service providers, and tenants like verticals while considering the performance requirements from future applications as well as security and regulatory compliance with Service Levels.",https://dl.acm.org/ft_gateway.cfm?id=3233254&ftid=1993427&dwn=1&CFID=84020132&CFTOKEN=a6f8f8e912c797a3-8C549BFF-CC18-FBDE-FEB65C7292D379D9,https://dl.acm.org/citation.cfm?id=3233254&preflayout=flat,0,111,August 2018,Framework for Security Event Management in 5G,"ARES 2018: Proceedings of the 13th International Conference on Availability, Reliability and Security"
81,"In response to the revival of virtualized technology by Rosenblum and Garfinkel [2005], NIST defined cloud computing, a new paradigm in service computing infrastructures. In cloud environments, the basic security mechanism is ingrained in virtualizationthat is, the execution of instructions at different privilege levels. Despite its obvious benefits, the caveat is that a crashed virtual machine (VM) is much harder to recover than a crashed workstation. When crashed, a VM is nothing but a giant corrupt binary file and quite unrecoverable by standard disk-based forensics. Therefore, VM crashes should be avoided at all costs. Security is one of the major contributors to such VM crashes. This includes compromising the hypervisor, cloud storage, images of VMs used infrequently, and remote cloud client used by the customer as well as threat from malicious insiders. Although using secure infrastructures such as private clouds alleviate several of these security problems, most cloud users end up using cheaper options such as third-party infrastructures (i.e., private clouds), thus a thorough discussion of all known security issues is pertinent. Hence, in this article, we discuss ongoing research in cloud security in order of the attack scenarios exploited most often in the cloud environment. We explore attack scenarios that call for securing the hypervisor, exploiting co-residency of VMs, VM image management, mitigating insider threats, securing storage in clouds, abusing lightweight software-as-a-service clients, and protecting data propagation in clouds. Wearing a practitioner's glasses, we explore the relevance of each attack scenario to a service company like Infosys. At the same time, we draw parallels between cloud security research and implementation of security solutions in the form of enterprise security suites for the cloud. We discuss the state of practice in the form of enterprise security suites that include cryptographic solutions, access control policies in the cloud, new techniques for attack detection, and security quality assurance in clouds.",https://dl.acm.org/ft_gateway.cfm?id=2693841&ftid=1544701&dwn=1&CFID=84020132&CFTOKEN=a6f8f8e912c797a3-8C549BFF-CC18-FBDE-FEB65C7292D379D9,https://dl.acm.org/citation.cfm?id=2693841&preflayout=flat,3,"1,781",February 2015,Secure the Cloud: From the Perspective of a Service-Oriented Organization,"ACM Computing Surveys (CSUR): Volume 47 Issue 3, April 2015"
82,"Secure cloud storage is considered one of the most important issues that both businesses and end-users are considering before moving their private data to the cloud. Lately, we have seen some interesting approaches that are based either on the promising concept of Symmetric Searchable Encryption (SSE) or on the well-studied field of Attribute-Based Encryption (ABE). In the first case, researchers are trying to design protocols where users' data will be protected from both ",https://dl.acm.org/ft_gateway.cfm?id=3297297&ftid=2053242&dwn=1&CFID=84020132&CFTOKEN=a6f8f8e912c797a3-8C549BFF-CC18-FBDE-FEB65C7292D379D9,https://dl.acm.org/citation.cfm?id=3297297&preflayout=flat,0,154,April 2019,The lord of the shares: combining attribute-based encryption and searchable encryption for flexible data sharing,SAC '19: Proceedings of the 34th ACM/SIGAPP Symposium on Applied Computing
83,"In this presentation at ACM Cloud Computing Security 2014, we will discuss how IBM transforms its approach to IT Security, as it moves its own enterprise computing into the cloud.",https://dl.acm.org/ft_gateway.cfm?id=2664185&ftid=1511606&dwn=1&CFID=84020132&CFTOKEN=a6f8f8e912c797a3-8C549BFF-CC18-FBDE-FEB65C7292D379D9,https://dl.acm.org/citation.cfm?id=2664185&preflayout=flat,0,422,November 2014,Securing Cloud Environments for Enterprise Computing,CCSW '14: Proceedings of the 6th edition of the ACM Workshop on Cloud Computing Security
84,"The transition between academic research and joining the industry workforce is often met with uncertainty, doubt, and changes in perspectives. Things that seem important while taking courses, reading through the literature, or getting captivated in a research topic can quickly change when starting to work in the industry. It takes many recent college graduates more time than expected to acclimate during their transition to the industry. This presentation will provide deeper insights into what to expect during the transition into industry, an overview of attacks the industry battles day-to-day, the importance of collaboration, details around why communication skills are a necessity, and methods for continuing to be a successful researcher as a security practitioner.",https://dl.acm.org/author_page.cfm?id=99659291814&coll=DL&dl=ACM&trk=0,https://dl.acm.org/citation.cfm?id=3258522&preflayout=flat,0,n/a,March 2018,Session details: Cloud Security,CODASPY '18: Proceedings of the Eighth ACM Conference on Data and Application Security and Privacy
85,"Countless systems ranging from consumer electronics to military equipment are dependent on integrated circuits (ICs). A surprisingly large number of such systems are already security- critical, e.g., automotive electronics, medical devices, or SCADA systems. If the underlying ICs in such applications are maliciously manipulated through hardware Trojans, the security of the entire system can be compromised. In recent years, hardware Trojans have drawn the attention of the scientific community and government. Initially, the primary attacker model was a malicious foundry that could alter the design, i.e., introduce hardware Trojans which could interfere with the functionality of a chip. Many other attacker models exist too. For instance, a legitimate IC manufacturer, such as a consumer electronics company, might be in cohort with a national intelligence agency and could alter its products in a way that compromises their security. Even though hardware Trojans have been studied for a decade or so in the literature, little is known about how they might look, and what the ""use cases"" for them is. We describe two applications for low-level hardware manipulations. One introduces an ASIC Trojans by sub-transistor changes, and the other is a novel type of fault-injection attacks against FPGAs. As an example for an extremely stealthy manipulations, we show how a dangerous Trojans can be introduced by merely changing the dopant polarity of selected existing transistors of a design. The Trojan manipulates the digital post-processing of Intel's cryptographically secure random number generator used in the Ivy Bridge processors. The adversary is capable of exactly controlling the entropy of the RNG. For example, the attacker can reduce the RNG's entropy to 40 bits of randomness. Due to the AES-based one-way function after the entropy extracting, the Trojan is very difficult to detect. Crucially, this approach does not require to add new circuits to the IC. Since the modified circuit appears legitimate on all wiring layers (including all metal and polysilicon), our family of Trojans is resistant to many detection techniques, including fine-grain optical inspection and checking against ""golden chips"". As a second ""use case"", we show how an adversary can extract cryptographic keys from an unknown FPGA design. The attack, coined bitstream fault injection (BiFI), systematically manipulates the bitstream by changing random LUT contents, configures the target device, and collects the resulting faulty ciphertexts. The ciphertexts are used to recover the key by testing a set of hypotheses, e.g., that the ciphertext is the plaintext XORed with the key. The attack only needs a black-box assumption about the bitstream structure and format. It was verified by considering a set of 3 rd party AES designs on different standard FPGAs. In 15 out of 16 designs, we were able to extract the AES key.",https://dl.acm.org/author_page.cfm?id=81500650510&coll=DL&dl=ACM&trk=0,https://dl.acm.org/citation.cfm?id=3248552&preflayout=flat,0,n/a,April 2017,Session details: Cloud Security,ASIA CCS '17: Proceedings of the 2017 ACM on Asia Conference on Computer and Communications Security
86,"We show attacks on several cryptographic schemes that have recently been proposed for achieving various security goals in sensor networks. Roughly speaking, these schemes all use ""perturbation polynomials"" to add ""noise"" to polynomialbased systems that offer information-theoretic security, in an attempt to increase the resilience threshold while maintaining efficiency. We show that the heuristic security arguments given for these modified schemes do not hold, and that they can be completely broken once we allow even a slight extension of the parameters beyond those achieved by the underlying information-theoretic schemes.",https://dl.acm.org/author_page.cfm?id=81548004690&coll=DL&dl=ACM&trk=0,https://dl.acm.org/citation.cfm?id=3252494&preflayout=flat,0,n/a,November 2009,Session details: Cloud security,CCS '09: Proceedings of the 16th ACM conference on Computer and communications security
87,"The public Infrastructure-as-a-Service (IaaS) cloud industry has reached a critical mass in the past few years, with many cloud service providers fielding competing services. Despite the competition, we find some of the security mechanisms offered by the services to be similar, indicating that the cloud industry has established a number of best-practices, while other security mechanisms vary widely, indicating that there is also still room for innovation and experimentation. We investigate these differences and possible underlying reasons for it. We also contrast the security mechanisms offered by public IaaS cloud offerings and with security mechanisms proposed by academia over the same period. Finally, we speculate on how industry and academia might work together to solve the pressing security problems in public IaaS clouds going forward.",https://dl.acm.org/ft_gateway.cfm?id=2767181&ftid=1598171&dwn=1&CFID=84020132&CFTOKEN=a6f8f8e912c797a3-8C549BFF-CC18-FBDE-FEB65C7292D379D9,https://dl.acm.org/citation.cfm?id=2767181&preflayout=flat,9,"1,570",June 2015,The State of Public Infrastructure-as-a-Service Cloud Security,"ACM Computing Surveys (CSUR): Volume 47 Issue 4, July 2015"
88,The possibility of a new $200-billion-plus industry has cloud security experts bracing for the ramifications.,https://dl.acm.org/https://cacm.acm.org/magazines/2013/6/164602/fulltext,https://dl.acm.org/citation.cfm?id=2461264&preflayout=flat,1,"7,959",June 2013,Augmented-reality glasses bring cloud security into sharp focus,"Communications of the ACM: Volume 56 Issue 6, June 2013"
89,"It is generally conceded that by embracing the cloud computing paradigm enterprises are able to boost their agility and productivity whilst realising significant cost savings. However, many enterprises are reluctant to adopt cloud services for supporting their critical operations due to security and privacy concerns. One way to alleviate these concerns is to devise a set of policies that infuse adequate security controls in cloud services. However, the heterogeneous nature of these services, together with the dynamicity inherent in cloud environments, hinders the formulation of an effective and interoperable set of policies that is suitable for the underlying domain of application. To this end, this work proposes an approach to the construction of ontological templates for the semantic representation of policies. These templates are capable of capturing the knowledge that must be infused into a policy in order for it to adequately take into account the needs of the underlying domain of application in which it is to be enforced.",https://dl.acm.org/ft_gateway.cfm?id=3003796&ftid=1843539&dwn=1&CFID=84020132&CFTOKEN=a6f8f8e912c797a3-8C549BFF-CC18-FBDE-FEB65C7292D379D9,https://dl.acm.org/citation.cfm?id=3003796&preflayout=flat,2,35,November 2016,Ontological Templates for Modelling Security Policies in Cloud Environments,PCI '16: Proceedings of the 20th Pan-Hellenic Conference on Informatics
90,"As more and more organizations move to cloud, it is inevitable that cross-organizational collaboration will need to be supported in the cloud. In this paper, we explore models for collaboration among clouds whose resources are distributed across multiple cloud service providers. In particular, we focus on collaboration and sharing of resources in an infrastructure as a service cloud, where compute resources complemented with storage and networking are offered as a service to customers by cloud service providers. We develop a multi-cloud trust model at different scopes of administration. At cloud level, infrastructure resources can be shared between clouds. At lower administrative scopes, cloud service providers are able to share their resources and service instances among customers within multiple clouds. Finally, we formally specify the administrative aspects of multi-cloud collaboration models we develop. We have implemented a proof of concept prototype based on the administrative model of OpenStack, the ",https://dl.acm.org/ft_gateway.cfm?id=2732523&ftid=1563489&dwn=1&CFID=84020132&CFTOKEN=a6f8f8e912c797a3-8C549BFF-CC18-FBDE-FEB65C7292D379D9,https://dl.acm.org/citation.cfm?id=2732523&preflayout=flat,4,299,April 2015,Authorization Federation in IaaS Multi Cloud,SCC '15: Proceedings of the 3rd International Workshop on Security in Cloud Computing
91,"Hadoop is a map-reduce implementation that rapidly processes data in parallel. Cloud provides reliability, flexibility, scalability, elasticity and cost saving to customers. Moving Hadoop into Cloud can be beneficial to Hadoop users. However, Hadoop has two vulnerabilities that can dramatically impact its security in a Cloud. The vulnerabilities are its overloaded authentication key, and the lack of fine-grained access control at the data access level. We propose and develop a security enhancement for Cloud-based Hadoop.",https://dl.acm.org/ft_gateway.cfm?id=2600202&ftid=1493599&dwn=1&CFID=84020132&CFTOKEN=a6f8f8e912c797a3-8C549BFF-CC18-FBDE-FEB65C7292D379D9,https://dl.acm.org/citation.cfm?id=2600202&preflayout=flat,0,255,April 2014,Securing Hadoop in cloud,HotSoS '14: Proceedings of the 2014 Symposium and Bootcamp on the Science of Security
92,"Data centric applications like remote healthcare application designed on a WSN-Cloud computing integrated architecture requires attention to its secure data management mechanism. A huge amount of data is generated in a health care application, which needs to be managed efficiently so that fast and reliable data communication and access can take place among the end users. In this research work we have proposed a flexible security model especially for data centric applications in cloud computing based scenario. This security model ensures data confidentiality, data integrity and fine grained access control to the application data. The objective of this work is to propose a secure framework to assist users at remote locations by considering the interoperability among different security solutions.",https://dl.acm.org/ft_gateway.cfm?id=2849559&ftid=1672608&dwn=1&CFID=84020132&CFTOKEN=a6f8f8e912c797a3-8C549BFF-CC18-FBDE-FEB65C7292D379D9,https://dl.acm.org/citation.cfm?id=2849559&preflayout=flat,1,210,January 2016,A cloud security framework for a data centric WSN application,ICDCN '16: Proceedings of the 17th International Conference on Distributed Computing and Networking
93,The great diffusion of cloud computing applications and services in the last years has brought new threats to security of information. ,https://dl.acm.org/ft_gateway.cfm?id=3025169&ftid=1947080&dwn=1&CFID=84020132&CFTOKEN=a6f8f8e912c797a3-8C549BFF-CC18-FBDE-FEB65C7292D379D9,https://dl.acm.org/citation.cfm?id=3025169&preflayout=flat,0,80,March 2017,Cloud security certifications: a comparison to improve cloud service provider security,"ICC '17: Proceedings of the Second International Conference on Internet of things, Data and Cloud Computing"
94,"The security of clients' applications on the cloud platforms has been of great interest. Security concerns associated with cloud computing are improving in both the domains; security issues faced by cloud providers and security issues faced by clients. However, security concerns still remain in domains like cloud auditing and migrating application components to cloud to make the process more secure and cost-efficient. To an extent, this can be attributed to a lack of detailed information being publicly present about the cloud platforms and their security policies. A resolution in this regard can be found in Cloud Security Alliance's Security, Trust, and Assurance Registry (STAR) which documents the security controls provided by popular cloud computing offerings. In this paper, we perform some descriptive analysis on STAR data in an attempt to comprehend the information publicly presented by different cloud providers. It is to help clients in more effectively searching and analyzing the required security information they need for the decision making process for hosting their applications on cloud. Based on the analysis, we outline some augmentations that can be made to STAR as well as certain specific design improvements for a cloud migration risk assessment framework.",https://dl.acm.org/ft_gateway.cfm?id=3154343&ftid=1939867&dwn=1&CFID=84020132&CFTOKEN=a6f8f8e912c797a3-8C549BFF-CC18-FBDE-FEB65C7292D379D9,https://dl.acm.org/citation.cfm?id=3154343&preflayout=flat,0,109,January 2018,"Data Analysis of Cloud Security Alliance's Security, Trust & Assurance Registry",ICDCN '18: Proceedings of the 19th International Conference on Distributed Computing and Networking
95,"In this paper, we report the first large-scale, systematic study on the security qualities of emerging push-messaging services, focusing on their app-side service integrations. We identified a set of security properties different push-messaging services (e.g., Google Cloud Messaging) need to have, and automatically verified them in different integrations using a new technique, called Seminal. Seminal is designed to extract semantic information from a service's sample code, and leverage the information to evaluate the security qualities of the service's SDKs and its integrations within different apps. Using this tool, we studied 30 leading services around the world, and scanned 35,173 apps. Our findings are astonishing: over 20% apps in Google Play and 50% apps in mainstream Chinese app markets are riddled with security-critical loopholes, putting a huge amount of sensitive user data at risk. Also, our research brought to light new types of security flaws never known before, which can be exploited to cause serious confusions among popular apps and services (e.g., Facebook, Skype, Yelp, Baidu Push). Taking advantage of such confusions, the adversary can post his content to the victim's apps in the name of trusted parties and intercept her private messages. The study highlights the serious challenges in securing push-messaging services and an urgent need for improving their security qualities.",https://dl.acm.org/ft_gateway.cfm?id=2813652&ftid=1631018&dwn=1&CFID=84020132&CFTOKEN=a6f8f8e912c797a3-8C549BFF-CC18-FBDE-FEB65C7292D379D9,https://dl.acm.org/citation.cfm?id=2813652&preflayout=flat,3,638,October 2015,Perplexed Messengers from the Cloud: Automated Security Analysis of Push-Messaging Integrations,CCS '15: Proceedings of the 22nd ACM SIGSAC Conference on Computer and Communications Security
96,"Searchable Symmetric Encryption (SSE) when deployed in the cloud allows one to query encrypted data without the risk of data leakage. Despite the widespread interest, existing surveys do not examine in detail how SSEs underlying structures are designed and how these result in the many properties of a SSE scheme. This is the gap we seek to address, as well as presenting recent state-of-the-art advances on SSE. Specifically, we present a general framework and believe the discussions may lead to insights for potential new designs. We draw a few observations. First, most schemes use index table, where optimal index size and sublinear search can be achieved using an inverted index. Straightforward updating can only be achieved using direct index, but search time would be linear. A recent trend is the combinations of index table, and tree, deployed for efficient updating and storage. Secondly, mechanisms from related fields such as Oblivious RAM (ORAM) have been integrated to reduce leakages. However, using these mechanisms to minimise leakages in schemes with richer functionalities (e.g., ranked, range) is relatively unexplored. Thirdly, a new approach (e.g., multiple servers) is required to mitigate new and emerging attacks on leakage. Lastly, we observe that a proposed index may not be practically efficient when implemented, where I/O access must be taken into consideration.",https://dl.acm.org/ft_gateway.cfm?id=3064005&ftid=1876779&dwn=1&CFID=84020132&CFTOKEN=a6f8f8e912c797a3-8C549BFF-CC18-FBDE-FEB65C7292D379D9,https://dl.acm.org/citation.cfm?id=3064005&preflayout=flat,4,"1,114",May 2017,Searchable Symmetric Encryption: Designs and Challenges,"ACM Computing Surveys (CSUR): Volume 50 Issue 3, October 2017"
97,"Cloud computing is a change agent to how information technologies are consumed by businesses and consumers. The agility, scale, and resiliency brought by the cloud fundamentally changed the IT economy for many organizations. However, security assurance for cloud continues to be a barrier for adoption. This talk surveys the current cloud security technology landscape and more specifically the subject of ""zero-knowledge protection"" (ZKP). Borrowed from zero-knowledge proof, ZKP is a concept that allows cloud users to leverage cloud application functions without revealing critical data to the cloud infrastructure. ZKP has far-reaching impact on privacy, government surveillance, and data residency. There is also much misconception on what ZKP is and is not capable of doing. This talk looks at the specifics of ZKP technologies, the use cases for which ZKP provides the most value, and the ensuing societal impact. We will examine how ZKP can work across various layers of the cloud, from IaaS to SaaS, and briefly touch on how ZKP can function with some of the newer cloud technologies like Linux Containers and Docker.",https://dl.acm.org/ft_gateway.cfm?id=2808427&ftid=1631163&dwn=1&CFID=84020132&CFTOKEN=a6f8f8e912c797a3-8C549BFF-CC18-FBDE-FEB65C7292D379D9,https://dl.acm.org/citation.cfm?id=2808427&preflayout=flat,0,277,October 2015,Cloud Security: The Industry Landscape and the Lure of Zero-Knowledge Protection,CCSW '15: Proceedings of the 2015 ACM Workshop on Cloud Computing Security Workshop
98,"Since new Computing Technology requires users to entrust their valuable data to the cloud providers, so there has been an increasing demand on security and privacy of the outsourced data. The Key based Hierarchy feature will not only strengthen the privacy of the private cloud but is comparatively more efficient against the enhanced facets in private cloud. The proposed scheme is scalable, reliable and flexible which provide secure access to the outsourced data to the cloud. The scope of proposed work is to develop a better security implication for private cloud with changing facets. Also to enhance the cloud security techniques through randomized motion evolved as a paradigm to concatenate with the hierarchical key based security. The 4 specific objectives for this research work includes Comparative Analysis of Security techniques for Secure cloud data and identifying major barriers for cloud security, propose a security technique for security in private Cloud Environment with changing facets, analysing and proposing a model for security with comparison with grids and their success rate..",https://dl.acm.org/ft_gateway.cfm?id=2677921&ftid=1537945&dwn=1&CFID=84020132&CFTOKEN=a6f8f8e912c797a3-8C549BFF-CC18-FBDE-FEB65C7292D379D9,https://dl.acm.org/citation.cfm?id=2677921&preflayout=flat,0,52,October 2014,Strengthening Private Cloud Security through effective random key Facet,ICTCS '14: Proceedings of the 2014 International Conference on Information and Communication Technology for Competitive Strategies
