,abstract,link4download,links,num_citations,num_downloads_cu,publication_date,title,venue
122,"It is our great pleasure to welcome you to the 8th ACM Cloud Computing Security Workshop (CCSW). Since its inception, CCSW has been a forum for bringing together researchers and practitioners to discuss technological advances bearing on the security of compute clouds, their tenants, and the larger Internet community. This year's workshop continues in this tradition.",https://dl.acm.org/author_page.cfm?id=81100621824&coll=DL&dl=ACM&trk=0,https://dl.acm.org/citation.cfm?id=3140649&preflayout=flat,6,"2,966",November 2017,CCSW '17: Proceedings of the 2017 on Cloud Computing Security Workshop,
123,It is our great pleasure to welcome you to the ,https://dl.acm.org/author_page.cfm?id=81460644513&coll=DL&dl=ACM&trk=0,https://dl.acm.org/citation.cfm?id=3055259&preflayout=flat,3,"1,922",April 2017,SCC '17: Proceedings of the Fifth ACM International Workshop on Security in Cloud Computing,
124,It is our great pleasure to welcome you to the 10th anniversary of the ACM Cloud Computing Security Workshop. CCSW is the world's premier forum bringing together researchers and practitioners in all security aspects of cloud-centric and outsourced computing including:,https://dl.acm.org/results.cfm?query=persons.authors.personName:%28%22Radu%20Sion%22%29 OR acmdlPersonName:%28%22Radu%20Sion%22%29,https://dl.acm.org/citation.cfm?id=3338466&preflayout=flat,0,41,November 2019,CCSW'19: Proceedings of the 2019 ACM SIGSAC Conference on Cloud Computing Security Workshop,
125,"Cloud services have recently been expanding rapidly, but business users are still in the minority compared with consumer users. From the viewpoint of organizational risk management, it is necessary to control the risks of the cloud computing environment used as part of an organization's information system in order to minimize any negative influence on the organization's mission or business processes. In a previous article, the authors divided cloud security metrics into two security levels. One level shows how the security metrics influence the mission or business processes in 27 dimensions. The other level shows the security status at the time and the influence range when an incident occurs. This article focuses the latter variable security level and describes the results of developing a cloud security visualization system that was designed based on collection, analysis, and visualization architecture to calculate the level. From the viewpoint of security risk management, the system is considerered to be effective for cloud service providers because it reduces the time needed to investigate the cause of incidents and to recover from them, it helps in triage assessment when many incidents happen simultaneously, and it can detect warnings of an incident and forestall such incidents before they occur.",https://dl.acm.org/ft_gateway.cfm?id=2372232&ftid=1291797&dwn=1&CFID=84020132&CFTOKEN=a6f8f8e912c797a3-8C549BFF-CC18-FBDE-FEB65C7292D379D9,https://dl.acm.org/citation.cfm?id=2372232&preflayout=flat,1,600,September 2012,Development of qualification of security status suitable for cloud computing system,MetriSec '12: Proceedings of the 4th international workshop on Security measurements and metrics
126,"To demonstrate compliance with privacy and security principles, information technology (IT) service providers often rely on security standards and certifications. However, the appearance of new service models such as cloud computing has brought new threats to information assurance, weakening the protection that existing standards can provide.",https://dl.acm.org/ft_gateway.cfm?id=3101277&ftid=1876745&dwn=1&CFID=84020132&CFTOKEN=a6f8f8e912c797a3-8C549BFF-CC18-FBDE-FEB65C7292D379D9,https://dl.acm.org/citation.cfm?id=3101277&preflayout=flat,0,99,May 2017,IT Security and Privacy Standards in Comparison: Improving FedRAMP Authorization for Cloud Service Providers,"CCGrid '17: Proceedings of the 17th IEEE/ACM International Symposium on Cluster, Cloud and Grid Computing"
127,"Cloud computing becomes a successful paradigm for data computing and storage. Increasing concerns about data security and privacy in the cloud, however, have emerged. Ensuring security and privacy for data management and query processing in the cloud is critical for better and broader uses of the cloud. This tutorial covers some common cloud security and privacy threats and the relevant research, while focusing on the works that protect data confidentiality and query access privacy for sensitive data being stored and queried in the cloud. We provide a comprehensive study of state-of-the-art schemes and techniques for protecting data confidentiality and access privacy, which make different tradeoffs in the multidimensional space of security, privacy, functionality and performance.",https://dl.acm.org/ft_gateway.cfm?id=2367569&ftid=1286083&dwn=1&CFID=84020132&CFTOKEN=a6f8f8e912c797a3-8C549BFF-CC18-FBDE-FEB65C7292D379D9,https://dl.acm.org/citation.cfm?id=2367569&preflayout=flat,5,604,August 2012,Secure and privacy-preserving data services in the cloud: a data centric view,"Proceedings of the VLDB Endowment: Volume 5 Issue 12, August 2012"
128,"The cloud computing is a powerful technology in IT environment to provide cost effective, easy to manage, elastic, provide on-demand scalable services over the Internet and is wish list of many organizations that they are still concerned about the security risks implied by moving their infrastructure into cloud computing, and by integrating their resources within the cloud computing environment.. To take advantage of all the benefits of cloud computing, it is necessary to have security and privacy requirements for the implementation and use of the cloud.",https://dl.acm.org/ft_gateway.cfm?id=3286865&ftid=2026114&dwn=1&CFID=84020132&CFTOKEN=a6f8f8e912c797a3-8C549BFF-CC18-FBDE-FEB65C7292D379D9,https://dl.acm.org/citation.cfm?id=3286865&preflayout=flat,0,60,October 2018,Risks and Security Requirements for Cloud Environments,SCA '18: Proceedings of the 3rd International Conference on Smart City Applications
129,"Cloud computing, as an emerging computing model, can provide users with inexpensive, convenient and large scale computing. In the recent years, both government and other organizations have begun to utilize cloud computing, such as the United States and European Union. However, deployment of clouds brings security challenges to consumers. Governmental cloud is a secure and trusted environment for government to deliver services to citizens. With the governmental use of cloud, there are many emerging risks and threats. It is important to focus on cloud security, governmental cloud in particular. United States proposed Security Reference Architecture and Challenging Security Requirements for US Government Cloud Computing Adoption and European Union proposed a security framework for governmental clouds. We introduce cloud computing, governmental cloud and risks related to use of cloud, then analyze the security frameworks of governmental cloud of United States and European Union. Finally, we make comparisons/comments on both frameworks from different perspectives.",https://dl.acm.org/ft_gateway.cfm?id=3017985&ftid=1833114&dwn=1&CFID=84020132&CFTOKEN=a6f8f8e912c797a3-8C549BFF-CC18-FBDE-FEB65C7292D379D9,https://dl.acm.org/citation.cfm?id=3017985&preflayout=flat,1,104,November 2016,Comparison of Security Frameworks for Governmental Clouds between United States and European Union,ICCNS '16: Proceedings of the 6th International Conference on Communication and Network Security
130,"Cloud security becomes a hot topic in the emerging new cloud environments. Customers would like to understand what happens when they move their applications, data and information on the cloud. Probably one of the most interesting questions is what are the new challenges that cloud virtual environment produces due to multitenancy and virtualization.",https://dl.acm.org/ft_gateway.cfm?id=2490285&ftid=1388042&dwn=1&CFID=84020132&CFTOKEN=a6f8f8e912c797a3-8C549BFF-CC18-FBDE-FEB65C7292D379D9,https://dl.acm.org/citation.cfm?id=2490285&preflayout=flat,2,395,September 2013,Security vulnerabilities from inside and outside the Eucalyptus cloud,BCI '13: Proceedings of the 6th Balkan Conference in Informatics
131,"Storing data in the cloud is often a long and disputed process of ensuring that cloud service providers meet the clients minimum requirements. Often, this process can be costly, lack adequate results, and miss important security checks that are often overlooked. Therefore, I propose a new strategy for meeting cloud security requirements through using a dynamic parsing agent to encrypt outgoing data using a ""multi-folded"" encryption hierarchy. While there are limitations to being truly secure, such as those recognized by WhiteHat Security in their annual reports[1], I believe my unique architecture will prove to be ideal in allowing any mobile device (i.e. User) to define how their data is stored in the cloud. Although we have found this approach useful for the mobile space, we believe it can also be applied to a variety of different audiences in need of a cloud data encryption system.",https://dl.acm.org/ft_gateway.cfm?id=3104123&ftid=1878003&dwn=1&CFID=84020132&CFTOKEN=a6f8f8e912c797a3-8C549BFF-CC18-FBDE-FEB65C7292D379D9,https://dl.acm.org/citation.cfm?id=3104123&preflayout=flat,0,23,May 2017,Using parsing agents as a service for data privacy,MOBILESoft '17: Proceedings of the 4th International Conference on Mobile Software Engineering and Systems
132,"The cloud is a utility computing infrastructure that has caused a paradigm shift in the way organisations requisition, allocate, and use IT resources. One big challenge is to preserve the confidentiality of information on the cloud. Most typical solutions use cryptographic techniques without considering how well suited they are to the cloud. This paper presents a performance case-study on implementing the building blocks of a privacy preserving collaborative filtering (PPCF) scheme in Java on the Google App Engine (GAE/J) cloud platform. The results show that the GAE/J in its current state exhibits serious performance bottlenecks for the chosen application scenario. This case study highlights the need for better performance from the GAE/J. It also informs the need for validating theoretical cloud security algorithms on real cloud computing platforms in which many performance expectations do not hold.",https://dl.acm.org/ft_gateway.cfm?id=2245362&ftid=1231257&dwn=1&CFID=84020132&CFTOKEN=a6f8f8e912c797a3-8C549BFF-CC18-FBDE-FEB65C7292D379D9,https://dl.acm.org/citation.cfm?id=2245362&preflayout=flat,3,359,March 2012,Feasibility of a privacy preserving collaborative filtering scheme on the Google App Engine: a performance case study,SAC '12: Proceedings of the 27th Annual ACM Symposium on Applied Computing
133,The rise of serverless computing provides an opportunity to rethink cloud security. We present an approach for securing serverless systems using a novel form of dynamic information flow control (IFC). ,https://dl.acm.org/ft_gateway.cfm?id=3276488&ftid=2011459&dwn=1&CFID=84020132&CFTOKEN=a6f8f8e912c797a3-8C549BFF-CC18-FBDE-FEB65C7292D379D9,https://dl.acm.org/citation.cfm?id=3276488&preflayout=flat,0,503,October 2018,Secure serverless computing using dynamic information flow control,"Proceedings of the ACM on Programming Languages: Volume 2 Issue OOPSLA, November 2018"
134,"The Cloud Security Alliance (CSA) provides a framework for cloud platform providers that manages standardized self-assessments regarding security controls. The framework as it stands does not allow consumers to specify and check their own requirements, nor does it contain any means for verifying the capabilities claimed by the providers. From a customer perspective, both these aspects are essential for evaluating the trustworthiness of cloud providers and for making an informed decision. We propose a novel concept for verifying the capabilities captured in the CSA's framework, plus a decision model that checks consumer requirements against the verification results. Our capability verification combines hard trust based on rigid validation with soft trust based on evidence about past behaviour. Elaborate formal methods are applied in both fields and combined into a single concept.",https://dl.acm.org/ft_gateway.cfm?id=2480727&ftid=1368299&dwn=1&CFID=84020132&CFTOKEN=a6f8f8e912c797a3-8C549BFF-CC18-FBDE-FEB65C7292D379D9,https://dl.acm.org/citation.cfm?id=2480727&preflayout=flat,4,200,March 2013,A framework for evaluating trust of service providers in cloud marketplaces,SAC '13: Proceedings of the 28th Annual ACM Symposium on Applied Computing
135,"Cloud computing security and reliability are important challenges in the research agenda. For some applications managing sensitive data, cloud security solutions and data-privacy management are the main concerns for organizations that are considering a move to the cloud. The advantages of cloud computing include reduced costs, easy maintenance and re-provisioning of resources, thereby also possibly increasing profits. But the adoption of Cloud Computing solutions applies only if different security concerns are ensured. This prototype presents a solution for data storage and data management in Internet Storage Clouds, preserving privacy conditions under the control of Cloud users. The prototype supports operations over stored encrypted data, including reading, writing and searching based on relevance ranking and multiple keywords. The prototype preserves data-privacy without need to either decipher data during operations in the Cloud or transfer the data during searches. The presented approach is based on a middleware architecture supported by homomorphic encryption techniques combined with dynamic indexing mechanisms.",https://dl.acm.org/ft_gateway.cfm?id=2491791&ftid=1376415&dwn=1&CFID=84020132&CFTOKEN=a6f8f8e912c797a3-8C549BFF-CC18-FBDE-FEB65C7292D379D9,https://dl.acm.org/citation.cfm?id=2491791&preflayout=flat,0,142,May 2013,CloudCryptoSearch: a prototype for secure searching of private data in cloud encrypted domains,OAIR '13: Proceedings of the 10th Conference on Open Research Areas in Information Retrieval
136,"We welcome you to the Eleventh International Conference on Security of Information and Networks (SIN 2018). The SIN series of conference provides an international forum for the presentation of research and applications of security in information and networks. SIN 2018 offered sessions on Cyber-Physical Systems, Network and Host Security, Cryptography, Applications, and Security Analytics, as well as three keynote talks on Blockchain and IoT-Cloud Security. An Industry Panel provided a platform to researchers and practitioners from both academia as well as industry to meet and share cutting-edge advancements in the field of information and network security. SIN 2018 was hosted by Cardiff University with active support from Edinburgh Napier University, Florida Atlantic University, and Aksaray University. SIN Conferences are organized under the auspices of a group of universities whose logos appear on the cover page.",https://dl.acm.org/author_page.cfm?id=81414621356&coll=DL&dl=ACM&trk=0,https://dl.acm.org/citation.cfm?id=3264437&preflayout=flat,0,"1,551",September 2018,SIN '18: Proceedings of the 11th International Conference on Security of Information and Networks,
137,"Our Dynamic Encryption Key Security Scheme (DEKSS) is a novel security strategy that utilizes a secure architecture to dispatch and manage data through multiple Cloud Service Providers (CSP). This strategy can promise data security for both clients and service providers without impacting the other party negatively. While there are limitations in being truly secure, such as those recognized by WhiteHat security in their annual reports[1],our security scheme can secure effectively data through being able to fold data in as many encrypted layers as desired for every table name and column of data stored. Through this approach, we have found it applicable to a variety of different audiences in the cloud security space.",https://dl.acm.org/ft_gateway.cfm?id=3104117&ftid=1878002&dwn=1&CFID=84020132&CFTOKEN=a6f8f8e912c797a3-8C549BFF-CC18-FBDE-FEB65C7292D379D9,https://dl.acm.org/citation.cfm?id=3104117&preflayout=flat,0,25,May 2017,Dynamic encryption key security scheme (DEKSS) for mobile and cloud systems,MOBILESoft '17: Proceedings of the 4th International Conference on Mobile Software Engineering and Systems
138,"There are many major security companies involved in developing security features on the cloud. According to Gartner, by 2020, 95% of cloud security errors will be the customer.",https://dl.acm.org/ft_gateway.cfm?id=3305181&ftid=2045713&dwn=1&CFID=84020132&CFTOKEN=a6f8f8e912c797a3-8C549BFF-CC18-FBDE-FEB65C7292D379D9,https://dl.acm.org/citation.cfm?id=3305181&preflayout=flat,1,50,January 2019,Security and Cost Optimization Auditing for Amazon Web Services,ICSIM 2019: Proceedings of the 2nd International Conference on Software Engineering and Information Management
139,"Cloud computing has promoted the notion of service as the leading way to deliver and consume computing resources. Today, security is going down that road and the term security as a service is emerging. Authorization that consists in managing permissions is one of the main classic security services. We propose in this article to study how authorization could be delivered/consumed as a Service. We focus on the XACML standard that has been adopted by the cloud security community because of its native flexibility and adaptability properties. Although XACML seems to fulfill the requirements of authorization as a Service in theory, it is very complex to realize it in practice. We propose a service oriented component architecture together with the concept self-contained policy to cope with this issue. This approach allows both the cloud consumers to adapt the authorization system to their authorization policies and the cloud providers to minimize the cost of providing a flexible authorization service.",https://dl.acm.org/ft_gateway.cfm?id=2499995&ftid=1379897&dwn=1&CFID=84020132&CFTOKEN=a6f8f8e912c797a3-8C549BFF-CC18-FBDE-FEB65C7292D379D9,https://dl.acm.org/citation.cfm?id=2499995&preflayout=flat,3,172,April 2013,Toward authorization as a service: a study of the XACML standard,CNS '13: Proceedings of the 16th Communications & Networking Symposium
140,"With more and more data being stored in the cloud, securing multimedia data is becoming increasingly important. Use of existing encryption methods with cloud services is possible, but makes many web-based applications difficult or impossible to use. In this paper, we propose a new image encryption scheme specially designed to protect JPEG images in cloud photo storage services. Our technique allows efficient reconstruction of an accurate low-resolution thumbnail from the ciphertext image, but aims to prevent the extraction of any more detailed information. This will allow efficient storage and retrieval of image data in the cloud but protect its contents from outside hackers or snooping cloud administrators. Experiments of the proposed approach using an online selfie database show that it can achieve a good balance of privacy, utility, image quality, and file size.",https://dl.acm.org/ft_gateway.cfm?id=2756618&ftid=1588135&dwn=1&CFID=84020132&CFTOKEN=a6f8f8e912c797a3-8C549BFF-CC18-FBDE-FEB65C7292D379D9,https://dl.acm.org/citation.cfm?id=2756618&preflayout=flat,1,157,June 2015,Thumbnail-Preserving Encryption for JPEG,IH&MMSec '15: Proceedings of the 3rd ACM Workshop on Information Hiding and Multimedia Security
141,"The paradigm of cloud computing is currently revolutionizing our way of communicating and computing. It impacts and redefines how we store, retrieve, process, and share information in business and private settings. The fact that increasingly many systems and services rely on this paradigm increases our dependence on the security, privacy, availability, and robustness of the involved operations, components, and systems.",https://dl.acm.org/author_page.cfm?id=81100471558&coll=DL&dl=ACM&trk=0,https://dl.acm.org/citation.cfm?id=2381913&preflayout=flat,70,"7,874",October 2012,CCSW '12: Proceedings of the 2012 ACM Workshop on Cloud computing security workshop,
142,"The distinction between mobile applications built for specific platforms and that run in mobile browsers is increasingly being blurred. As HTML5 becomes universally deployed and mobile web apps directly take advantage of device features such as the camera, microphone and geolocation information, this difference will vanish almost entirely. In spite of this increasing similarity, the permission systems protecting mobile device resources for native",https://dl.acm.org/ft_gateway.cfm?id=2381939&ftid=1296229&dwn=1&CFID=84020132&CFTOKEN=a6f8f8e912c797a3-8C549BFF-CC18-FBDE-FEB65C7292D379D9,https://dl.acm.org/citation.cfm?id=2381939&preflayout=flat,0,587,October 2012,Short paper: rethinking permissions for mobile web apps: barriers and the road ahead,SPSM '12: Proceedings of the second ACM workshop on Security and privacy in smartphones and mobile devices
143,"Because of the explosive growth of Android malware and due to the severity of its damages, the detection of Android malware has become an increasing important topic in cybersecurity. Currently, the major defense against Android malware is commercial mobile security products which mainly use signature-based method for detection. However, attackers can easily devise methods, such as obfuscation and repackaging, to evade the detection, which calls for new defensive techniques that are harder to evade. In this paper, resting on the analysis of Application Programming Interface (API) calls extracted from the smali files, we further categorize the API calls which belong to the some method in the smali code into a block. Based on the generated API call blocks, we then explore deep neural networks (i.e., Deep Belief Network (DBN) and Stacked AutoEncoders (SAEs)) for newly unknown Android malware detection. Using a real sample collection from Comodo Cloud Security Center, a comprehensive experimental study is performed to compare various malware detection approaches. The experimental results demonstrate that (1) our proposed feature extraction method (i.e., using API call blocks) outperforms using API calls directly in Android malware detection; (2) DBN works better than SAEs in this application; and (3) the detection performance of deep neural networks is better than shallow learning architectures.",https://dl.acm.org/ft_gateway.cfm?id=3116211&ftid=1921987&dwn=1&CFID=84020132&CFTOKEN=a6f8f8e912c797a3-8C549BFF-CC18-FBDE-FEB65C7292D379D9,https://dl.acm.org/citation.cfm?id=3116211&preflayout=flat,0,221,July 2017,Deep Neural Networks for Automatic Android Malware Detection,ASONAM '17: Proceedings of the 2017 IEEE/ACM International Conference on Advances in Social Networks Analysis and Mining 2017
144,"With explosive growth of Android malware and due to the severity of its damages to smart phone users, the detection of Android malware has become increasingly important in cybersecurity. The increasing sophistication of Android malware calls for new defensive techniques that are capable against novel threats and harder to evade. In this paper, to detect Android malware, instead of using Application Programming Interface (API) calls only, we further analyze the different relationships between them and create higher-level semantics which require more effort for attackers to evade the detection. We represent the Android applications (apps), related APIs, and their rich relationships as a structured heterogeneous information network (HIN). Then we use a meta-path based approach to characterize the semantic relatedness of apps and APIs. We use each meta-path to formulate a similarity measure over Android apps, and aggregate different similarities using multi-kernel learning. Then each meta-path is automatically weighted by the learning algorithm to make predictions. To the best of our knowledge, this is the first work to use structured HIN for Android malware detection. Comprehensive experiments on real sample collections from Comodo Cloud Security Center are conducted to compare various malware detection approaches. Promising experimental results demonstrate that our developed system ",https://dl.acm.org/ft_gateway.cfm?id=3098026&ftid=1899039&dwn=1&CFID=84020132&CFTOKEN=a6f8f8e912c797a3-8C549BFF-CC18-FBDE-FEB65C7292D379D9,https://dl.acm.org/citation.cfm?id=3098026&preflayout=flat,15,"2,894",August 2017,HinDroid: An Intelligent Android Malware Detection System Based on Structured Heterogeneous Information Network,KDD '17: Proceedings of the 23rd ACM SIGKDD International Conference on Knowledge Discovery and Data Mining
145,"It is our great pleasure to introduce the technical program for the 4th International Workshop on Hardware and Architectural Support for Security and Privacy (HASP 2015), which will be held in conjunction with the 42nd International Symposium on Computer Architecture (ISCA 2015) in Portland, OR, USA. The workshop will run on June 14, 2015.",https://dl.acm.org/author_page.cfm?id=81100384586&coll=DL&dl=ACM&trk=0,https://dl.acm.org/citation.cfm?id=2768566&preflayout=flat,30,"1,491",June 2015,HASP '15: Proceedings of the Fourth Workshop on Hardware and Architectural Support for Security and Privacy,
