,abstract,link4download,links,num_citations,num_downloads_cu,publication_date,title,venue
41,"As Cloud platforms gain increasing traction among scientific and business communities for outsourcing storage, computing and content delivery, there is also growing concern about the associated loss of control over private data hosted in the Cloud. In this paper, we present an architecture for a secure data repository service designed on top of a public Cloud infrastructure to support multi-disciplinary scientific communities dealing with personal and human subject data, motivated by the smart power grid domain. Our repository model allows users to securely store and share their data in the Cloud without revealing the plain text to unauthorized users, the Cloud storage provider or the repository itself. The system masks file names, user permissions and access patterns while providing auditing capabilities with provable data updates.",https://dl.acm.org/ft_gateway.cfm?id=2087530&ftid=1072500&dwn=1&CFID=84020132&CFTOKEN=a6f8f8e912c797a3-8C549BFF-CC18-FBDE-FEB65C7292D379D9,https://dl.acm.org/citation.cfm?id=2087530&preflayout=flat,1, 724,November 2011,Designing a secure storage repository for sharing scientific datasets using public clouds,DataCloud-SC '11: Proceedings of the second international workshop on Data intensive computing in the clouds
42,"Public auditing protocol is very important and efficient security service for ensuring the outsourced data since it can be used to audit the integrity of the stored data in cloud with a lower cost. Recently, Cao et al. presented a data integrity verification protocol in mobile Multi-cloud computing environment using the bilinear pairing. Unfortunately, in this paper, we show that their protocol is insecure against malicious cloud server's forgery attack and replacing attack. After deleting all the outsourced data, the malicious cloud server can pass the verification of data integrity without being found by the auditor. Then the corresponding detail attack is given and we also analyze the reason to produce such attack.",https://dl.acm.org/ft_gateway.cfm?id=3199499&ftid=1986460&dwn=1&CFID=84020132&CFTOKEN=a6f8f8e912c797a3-8C549BFF-CC18-FBDE-FEB65C7292D379D9,https://dl.acm.org/citation.cfm?id=3199499&preflayout=flat,0,51,March 2018,On the Security of a Data Integrity Auditing Scheme in Mobile Multi-cloud Environment,"ICCSP 2018: Proceedings of the 2nd International Conference on Cryptography, Security and Privacy"
43,"Cloud storage providers such as Dropbox and Google drive heavily rely on data deduplication to save storage costs by only storing one copy of each uploaded file. Although recent studies report that whole file deduplication can achieve up to 50% storage reduction, users do not directly benefit from these savings-as there is no transparent relation between effective storage costs and the prices offered to the users. In this paper, we propose a novel storage solution, ClearBox, which allows a storage service provider to transparently attest to its customers the deduplication patterns of the (encrypted) data that it is storing. By doing so, ClearBox enables cloud users to verify the effective storage space that their data is occupying in the cloud, and consequently to check whether they qualify for benefits such as price reductions, etc. ClearBox is secure against malicious users and a rational storage provider, and ensures that files can only be accessed by their legitimate owners. We evaluate a prototype implementation of ClearBox using both Amazon S3 and Dropbox as back-end cloud storage. Our findings show that our solution works with the APIs provided by existing service providers without any modifications and achieves comparable performance to existing solutions.",https://dl.acm.org/ft_gateway.cfm?id=2813630&ftid=1630959&dwn=1&CFID=84020132&CFTOKEN=a6f8f8e912c797a3-8C549BFF-CC18-FBDE-FEB65C7292D379D9,https://dl.acm.org/citation.cfm?id=2813630&preflayout=flat,9,786,October 2015,Transparent Data Deduplication in the Cloud,CCS '15: Proceedings of the 22nd ACM SIGSAC Conference on Computer and Communications Security
44,"Using a mobile device to store sensitive data is not recommended, because of the high possibility of losing or thieving these data, although, neither using single cloud as a storage service is not proper solution for number of reasons, for instance, the data could be captured while uploaded to the cloud, and the data could be stolen from the cloud via using stolen ID. In this paper, we propose an approach that aims to offer a secure data storage for mobile cloud computing users based on multi-clouds scheme. The proposed approach will take the advantages of multi-clouds, data cryptography, and data compression to secure the distributed data, by splitting the data into segments, encrypting the segments, compressing the segments, distributing the segments via multi-clouds while keeping one segment on the mobile device memory, which will prevent extracting the data if the distributed segments have been phished.",https://dl.acm.org/ft_gateway.cfm?id=2760113&ftid=1565469&dwn=1&CFID=84020132&CFTOKEN=a6f8f8e912c797a3-8C549BFF-CC18-FBDE-FEB65C7292D379D9,https://dl.acm.org/citation.cfm?id=2760113&preflayout=flat,2,187,December 2014,Multi-clouds Mobile Computing for the Secure Storage of Data,UCC '14: Proceedings of the 2014 IEEE/ACM 7th International Conference on Utility and Cloud Computing
45,"Cloud monitoring is an essential mechanism for helping secure cloud services. Thus, a plethora of monitoring schemas have been proposed in recent years. Particularly, a newly proposed indirect monitoring mechanism outperforms others with the unique merit of addressing scenarios where the information of the monitoring target is not directly accessible. To conduct indirect cloud security monitoring, a key prerequisite is to obtain a special set of monitoring data termed ""monitoring path"". However, how to ascertain the monitoring path is still an open issue.",https://dl.acm.org/ft_gateway.cfm?id=3230860&ftid=1993501&dwn=1&CFID=84020132&CFTOKEN=a6f8f8e912c797a3-8C549BFF-CC18-FBDE-FEB65C7292D379D9,https://dl.acm.org/citation.cfm?id=3230860&preflayout=flat,0,41,August 2018,Flashlight: A Novel Monitoring Path Identification Schema for Securing Cloud Services,"ARES 2018: Proceedings of the 13th International Conference on Availability, Reliability and Security"
46,"Security concerns are often mentioned amongst the reasons why organizations hesitate to adopt Cloud computing. Given that multiple Cloud Service Providers (CSPs) offer similar security services (e.g., ""encryption key management"") albeit with different capabilities and prices, the customers need to comparatively assess the offered security services in order to select the best CSP matching their security requirements. However, the presence of both explicit and implicit dependencies across security related services add further challenges for Cloud customers to (i) specify their security requirements taking service dependencies into consideration and (ii) to determine which CSP can satisfy these requirements. We present a framework to address these challenges. For challenge (i), our framework automatically detects conflicts resulting from inconsistent customer requirements. Moreover, our framework provides an explanation for the detected conflicts allowing customers to resolve these conflicts. To tackle challenge (ii), our framework assesses the security level provided by various CSPs and ranks the CSPs according to the desired customer requirements. We demonstrate the framework's effectiveness with real-world CSP case studies derived from the Cloud Security Alliance's Security, Trust and Assurance Registry.",https://dl.acm.org/ft_gateway.cfm?id=2897911&ftid=1730911&dwn=1&CFID=84020132&CFTOKEN=a6f8f8e912c797a3-8C549BFF-CC18-FBDE-FEB65C7292D379D9,https://dl.acm.org/citation.cfm?id=2897911&preflayout=flat,0,298,May 2016,Identifying and Utilizing Dependencies Across Cloud Security Services,ASIA CCS '16: Proceedings of the 11th ACM on Asia Conference on Computer and Communications Security
47,"The emergence of cost-effective cloud services offers organizations great opportunity to reduce their cost and increase productivity. This development, however, is hampered by privacy concerns: a significant amount of organizational computing workload at least partially involves sensitive data and therefore cannot be directly outsourced to the public cloud. The scale of these computing tasks also renders existing secure outsourcing techniques less applicable. A natural solution is to split a task, keeping the computation on the private data within an organization's private cloud while moving the rest to the public commercial cloud. However, this hybrid cloud computing is not supported by today's data-intensive computing frameworks, MapReduce in particular, which forces the users to manually split their computing tasks. In this paper, we present a suite of new techniques that make such privacy-aware data-intensive computing possible. Our system, called Sedic, leverages the special features of MapReduce to automatically partition a computing job according to the security levels of the data it works on, and arrange the computation across a hybrid cloud. Specifically, we modified MapReduce's distributed file system to strategically replicate data, moving sanitized data blocks to the public cloud. Over this data placement, map tasks are carefully scheduled to outsource as much workload to the public cloud as possible, given sensitive data always stay on the private cloud. To minimize inter-cloud communication, our approach also automatically analyzes and transforms the reduction structure of a submitted job to aggregate the map outcomes within the public cloud before sending the result back to the private cloud for the final reduction. This also allows the users to interact with our system in the same way they work with MapReduce, and directly run their legacy code in our framework. We implemented Sedic on Hadoop and evaluated it using both real and synthesized computing jobs on a large-scale cloud test-bed. The study shows that our techniques effectively protect sensitive user data, offload a large amount of computation to the public cloud and also fully preserve the scalability of MapReduce.",https://dl.acm.org/ft_gateway.cfm?id=2046767&ftid=1047067&dwn=1&CFID=84020132&CFTOKEN=a6f8f8e912c797a3-8C549BFF-CC18-FBDE-FEB65C7292D379D9,https://dl.acm.org/citation.cfm?id=2046767&preflayout=flat,27,"1,884",October 2011,Sedic: privacy-aware data intensive computing on hybrid clouds,CCS '11: Proceedings of the 18th ACM conference on Computer and communications security
48,"Recent technological advances have given rise to the popularity and success of cloud. This new paradigm is gaining an expanding interest, since it provides cost efficient architectures that support the transmission, storage, and intensive computing of data. However, the prospect of outsourcing an increasing amount of data storage and management, the abstract nature of the cloud and the diversity of the delivered services increase their vulnerability to security incidents and attacks. The objective of this paper is to provide a comprehensive review of the existing security requirements in cloud storage environments. In addition, it explores ID-based Cryptography power to address the protection of cloud storage infrastructures. As a main contribution, a new authentication scheme for Cloud-based Storage applications is proposed.",https://dl.acm.org/ft_gateway.cfm?id=2951963&ftid=1758991&dwn=1&CFID=84020132&CFTOKEN=a6f8f8e912c797a3-8C549BFF-CC18-FBDE-FEB65C7292D379D9,https://dl.acm.org/citation.cfm?id=2951963&preflayout=flat,1,176,July 2016,A New Authentication Scheme for Cloud-based Storage Applications,SIN '16: Proceedings of the 9th International Conference on Security of Information and Networks
49,"Vehicular Ad Hoc Networks (VANET) are the largest real life application of ad-hoc networks where nodes are represented via fast moving vehicles. This paper introduces the future emerging technology, i.e., Vehicular Cloud Networking (VCN) where vehicles and adjacent infrastructure merge with traditional internet clouds to offer different applications ranging from low sized applications to very complex applications. VCN is composed of three types of clouds: Vehicular cloud, Infrastructure cloud and traditional Back-End (IT) cloud. We introduced these clouds via a three tier architecture along with their operations and characteristics. We have proposed use cases of each cloud tier that explain how it is practically created and utilised while taking the vehicular mobility in consideration. Moreover, it is critical to ensure security, privacy and trust of VCN network and its assets. Therefore, to describe the security of VCN, we have provided an in-depth analysis of different threats related to each tier of VCN. The threats related to vehicular cloud and infrastructure cloud are categorized according to their assets, i.e., vehicles, adjacent infrastructure, wireless communication, vehicular messages, and vehicular cloud threats. Similarly, the Back-End cloud threats are categorized into data and network threats. The possible implications of these threats and their effects on various components of VCN are also explained in detail.",https://dl.acm.org/ft_gateway.cfm?id=3233510&ftid=1981199&dwn=1&CFID=84020132&CFTOKEN=a6f8f8e912c797a3-8C549BFF-CC18-FBDE-FEB65C7292D379D9,https://dl.acm.org/citation.cfm?id=3233510&preflayout=flat,1,17,December 2015,"Vehicular cloud networks: architecture, applications and security issues",UCC '15: Proceedings of the 8th International Conference on Utility and Cloud Computing
50,"PRINCESS (Proxy Re-encryption with INd-Cca security in an Encrypted file Storage System) is a secure storage system which utilizes special proxy re-encryption technology. With PRINCESS, the files encrypted in accordance with the confidentiality levels can be shared among appointed users while remaining encrypted. In this poster/demo, we show the efficiency of PRINCESS, which can be applied to a Body Area Network information sharing, automobile information sharing, etc. This system facilitates the potential for new services that require privacy data to be shared securely via cloud technology.",https://dl.acm.org/ft_gateway.cfm?id=2810123&ftid=1631012&dwn=1&CFID=84020132&CFTOKEN=a6f8f8e912c797a3-8C549BFF-CC18-FBDE-FEB65C7292D379D9,https://dl.acm.org/citation.cfm?id=2810123&preflayout=flat,0,237,October 2015,POSTER: PRINCESS: A Secure Cloud File Storage System for Managing Data with Hierarchical Levels of Sensitivity,CCS '15: Proceedings of the 22nd ACM SIGSAC Conference on Computer and Communications Security
51,"The need for storage and movement of data in today's ever increasing data usage cannot be overemphasized. As a result, storage and movement of data within the cloud becomes a viable option, even though this is a third party and some of the data may be sensitive. Therefore, the security methods in place have to continually be reviewed so as to get the best method or a combination of methods in this ever changing and demanding field. In this paper, the authors have done a formal assessment and examination of cloud systems key cryptographic algorithms and given a recommendation of the best combination of algorithms as a result of our different parameters of considerations. These parameters include whether they are a stream or block cipher and their key size or the hash value. The authors found out that the most viable cryptographic methods for securing the cloud systems are AES, Blowfish, Diffie-Hellman, RSA and SHA-1 which are from symmetric, asymmetric and hashing cryptographic algorithm. They further noted that a hybrid of the three cryptographic algorithms is more effective than an exclusive use of one cryptographic algorithm. They propose a combination of AES, Diffie-Hellman and SHA-1 algorithm for optimum cloud security.",https://dl.acm.org/ft_gateway.cfm?id=3242853&ftid=2002592&dwn=1&CFID=84020132&CFTOKEN=a6f8f8e912c797a3-8C549BFF-CC18-FBDE-FEB65C7292D379D9,https://dl.acm.org/citation.cfm?id=3242853&preflayout=flat,0,61,July 2018,An Evaluation on Securing Cloud Systems based on Cryptographic Key Algorithms,"ICACS '18: Proceedings of the 2018 2nd International Conference on Algorithms, Computing and Systems"
52,"Proofs of Retrievability (POR) are cryptographic proofs that enable a cloud provider to prove that a user can retrieve his file in its entirety. POR need to be frequently executed by the user to ensure that their files stored on the cloud can be fully retrieved at any point in time. To conduct and verify POR, users need to be equipped with devices that have network access, and that can tolerate the (non-negligible) computational overhead incurred by the verification process. This clearly hinders the large-scale adoption of POR by cloud users, since many users increasingly rely on portable devices that have limited computational capacity, or might not always have network access.",https://dl.acm.org/ft_gateway.cfm?id=2660310&ftid=1512399&dwn=1&CFID=84020132&CFTOKEN=a6f8f8e912c797a3-8C549BFF-CC18-FBDE-FEB65C7292D379D9,https://dl.acm.org/citation.cfm?id=2660310&preflayout=flat,11,837,November 2014,Outsourced Proofs of Retrievability,CCS '14: Proceedings of the 2014 ACM SIGSAC Conference on Computer and Communications Security
53,"Social Inclusion through the Digital Economy (SiDE) is a 12M project investigating how advanced technologies can be used to improve the lives of those from vulnerable groups including older people, disabled people, and marginalised youth. New digital technologies create the possibility of transforming the lives of those who find themselves in this position, but research is needed to realise that potential: this is the goal of SiDE. The talk will focus on how cloud computing is key to the solutions being explored, for example analysing accelerometer data to understand people's activity and thereby improve their health. The cloud research is based around e-Science Central - a portable, scalable, secure cloud platform. The talk will explain how the challenges of SiDE's applications have been addressed through the design of e-Science Central, including recent work on exploiting federated clouds to meet security and performance requirements. Based at Newcastle and Dundee Universities, SiDE is funded by RCUK through its Digital Economy programme.",https://dl.acm.org/ft_gateway.cfm?id=2287038&ftid=1249059&dwn=1&CFID=84020132&CFTOKEN=a6f8f8e912c797a3-8C549BFF-CC18-FBDE-FEB65C7292D379D9,https://dl.acm.org/citation.cfm?id=2287038&preflayout=flat,0,253,June 2012,Cloud computing for social inclusion: keynote talk,ScienceCloud '12: Proceedings of the 3rd workshop on Scientific Cloud Computing
54,"Many security and forensic analyses rely on the ability to fetch memory snapshots from a target machine. To date, the security community has relied on virtualization, external hardware or trusted hardware to obtain such snapshots. These techniques either sacrifice snapshot consistency or degrade the performance of applications executing atop the target. We present SnipSnap, a new snapshot acquisition system based on on-package DRAM technologies that offers snapshot consistency without excessively hurting the performance of the target's applications. We realize SnipSnap and evaluate its benefits using careful hardware emulation and software simulation, and report our results.",https://dl.acm.org/ft_gateway.cfm?id=3176325&ftid=1951192&dwn=1&CFID=84020132&CFTOKEN=a6f8f8e912c797a3-8C549BFF-CC18-FBDE-FEB65C7292D379D9,https://dl.acm.org/citation.cfm?id=3176325&preflayout=flat,1,93,March 2018,"Secure, Consistent, and High-Performance Memory Snapshotting",CODASPY '18: Proceedings of the Eighth ACM Conference on Data and Application Security and Privacy
55,"Cloud computing has emerged as a popular computing paradigm in recent years. However, today's cloud computing architectures often lack support for computer forensic investigations. Analyzing various logs (e.g., process logs, network logs) plays a vital role in computer forensics. Unfortunately, collecting logs from a cloud is very hard given the black-box nature of clouds and the multi-tenant cloud models, where many users share the same processing and network resources. Researchers have proposed using log API or cloud management console to mitigate the challenges of collecting logs from cloud infrastructure. However, there has been no concrete work, which shows how to provide cloud logs to investigator while preserving users' privacy and integrity of the logs. In this paper, we introduce Secure-Logging-as-a-Service (SecLaaS), which stores virtual machines' logs and provides access to forensic investigators ensuring the confidentiality of the cloud users. Additionally, SeclaaS preserves proofs of past log and thus protects the integrity of the logs from dishonest investigators or cloud providers. Finally, we evaluate the feasibility of the scheme by implementing SecLaaS for network access logs in OpenStack -- a popular open source cloud platform.",https://dl.acm.org/ft_gateway.cfm?id=2484342&ftid=1370411&dwn=1&CFID=84020132&CFTOKEN=a6f8f8e912c797a3-8C549BFF-CC18-FBDE-FEB65C7292D379D9,https://dl.acm.org/citation.cfm?id=2484342&preflayout=flat,17,"1,092",May 2013,SecLaaS: secure logging-as-a-service for cloud forensics,"ASIA CCS '13: Proceedings of the 8th ACM SIGSAC symposium on Information, computer and communications security"
56,"Information storage systems usually take great care for protecting their sensitive or confidential data, even users personal data. Hence the need to implement the concept of information security as part of the system. Information security primary focus is the balanced protection of the confidentiality, integrity and availability of stored data (CIA). Cloud system is one of the platforms that provides a database as a service (DBaaS), typically it takes care of scalability and high availability of the database. The confidentiality and integrity of stored data is still not guaranteed by some cloud systems because there is no trust between data owners and third-party platforms (Cloud systems). CryptDBaaS is a security model integrating cloud computing with cryptography to provide a security mechanism for data owners, which aims to guarantee the confidentiality of stored data in the cloud from unauthorized access or misuse of data from third party. CryptDBaaS model illustrates how to encrypt your data before storing it using secure and suitable encryption algorithms based on data type and allows to execute queries and performs some mathematical and logical operations over encrypted database. CryptDBaaS is evaluated by conducting a simulation to measure performance and accuracy of queries and search techniques CryptDBaaS provides. Evaluation step shows that CryptDBaaS has a high performance with respect to the encryption and search algorithms. The queries are executed as if they were executed over plain text data, so the obtained accuracy is 100% for all queries and operators except the search one which has 50% or 100% of accuracy based on chosen technique.",https://dl.acm.org/ft_gateway.cfm?id=3231068&ftid=2000020&dwn=1&CFID=84020132&CFTOKEN=a6f8f8e912c797a3-8C549BFF-CC18-FBDE-FEB65C7292D379D9,https://dl.acm.org/citation.cfm?id=3231068&preflayout=flat,0,58,June 2018,CryptDBaaS: query over encrypted DBaaS without third-party,ICFNDS '18: Proceedings of the 2nd International Conference on Future Networks and Distributed Systems
57,Users' trust in cloud systems is undermined by the lack of transparency in existing security policies.,https://dl.acm.org/https://cacm.acm.org/magazines/2014/5/174349/fulltext,https://dl.acm.org/citation.cfm?id=2593686&preflayout=flat,2," 37,383",May 2014,Cloud security: a gathering storm,"Communications of the ACM: Volume 57 Issue 5, May 2014"
58,"In IaaS (such as Amazon EC2 and Microsoft Azure), several VM (virtual-machine) instances usually run in one physical machine so as to improve resource utilization. However this also caused more attack opportunities. A typical example is a cross-VM timing channel. Recent studies show that this kind of covert channel can successfully steal private information (e.g. private key) from the co-resident VM instances. It brought great challenges to the security of the cloud and has absorbed more and more attention in recent years. But to our knowledge, there is still little work on detecting and investigating such covert channel. Therefore, we propose a behavior-based method to automatically detect and investigate the timing channel. First, in order to record the behavior of this covert channel, a page-level memory monitoring method is designed. Second, an automatic identification algorithm is proposed based on some memory activity signatures. Finally, in order to confirm the result, the memory dump will be obtained and the binary code of the suspicious process will be analyzed. We have implemented a prototype on Xen, and the experimental results show that all of these kinds of attacks can be detected even under the disturbance from normal processes.",https://dl.acm.org/ft_gateway.cfm?id=3021402&ftid=1817730&dwn=1&CFID=84020132&CFTOKEN=a6f8f8e912c797a3-8C549BFF-CC18-FBDE-FEB65C7292D379D9,https://dl.acm.org/citation.cfm?id=3021402&preflayout=flat,0,73,June 2016,Investigating Timing Channel in IaaS,MobiMedia '16: Proceedings of the 9th EAI International Conference on Mobile Multimedia Communications
